Feedback,professor
과제는 단 1번! 기간도 무지 길다! 팀플 그런거 전혀 없다! 전혀!!,한성구
유일한 단점은  성적에 대한 갈피를 잡을 수 없다는 점,한성구
논어 중에는 꿀강이라고 이야기 할 수 있을 것 같아요! 팀플 발표 없고 교수님께서 교양으로 학생들한테 부담주고 싶어하지 않으셔서 시험도 필기 오픈북이고 공부할 것도 별로 없어요! 수업 들으면서 필기 열심히 하고 시험 전에 한두번 읽어보면 충분합니다,한성구
 시험문제는 올 서술형인데 중요하다고 생각하는 부분에서 내고 그다지 어렵지도 않았습니다! 학점도 잘 주시는 편인 것 같아요! 교수님도 너무 좋으신 분이셔서 부담없는 논어 듣고 싶으시면 추천합니다!,한성구
논어 중에서는 진짜 꿀인 것 같아요. 팀플도 없고 과제 4,한성구
5페이지 에세이 하나에 시험 2번인데 다 오픈북ㅋㅋ 단 평소 수업시간에 열심히 필기를 하고 ppt 사진을 찍어놔야해요. 따로 자료를 주시지는 않습니다. ,한성구
아쉬운 점은 음... 한 학기동안 뭘 배웠는지 모르겠다는 점?ㅋㅋ 분명 교수님께서 박학다식하신 건 알겠는데... 1학년 때 들었던 동사입에서 배웠던거에 비해서 그런지 좀 아쉬웠어요. 진짜 그냥 교양이구나,한성구
하는 느낌! 그리고 시험 성적을 아예 안 알려주신다는 점! 그래서 학점 예측이 전혀 안 되서 나올때까지 ㄷㄷ하고 있어야해요...,한성구
그래도 논어 중에 이정도 꿀강은 찾기 힘들 것 같네요ㅋㅋ추천해요ㅋㅋㅋ,한성구
오픈북이고 팀플없고 과제하나여서 논어중엔 좋은괴목인것같아요,한성구
"중간 기말 모두 오픈북이여서 시험치는거는 걱정이 없었는데, 사실 논어라기보다는 인문학 강의??에 더 가까운 느낌이었습니다..! 그래도 아시는 것 많은 것 같고 ",한성구
우리때는,한성구
 오픈북이여서 무난했던 수업 같습니다.,한성구
이 정보를 확인하기 위해 포인트를 사용하시겠습,한성구
이 정보를 확인하기 위해 포인트를 사용하시겠습니까. 포인트를 사용하시겠습니까. 이 시험 정보를 확인하기 위해 포인트가 차감됩니다. 사용하시겠습니까. 이 정보를 확인하기 위해 포인트를 사용하시겠습니까. 포인트를 사용하시겠습니까. 이 시험 정보를 확인하기 위해 포인트가 차감됩니다. 사용하시겠습니까. 이 정보를 확인하기 위해 포인트를 사용하시겠습니까. 포인트를 사용하시겠습니까. 이 시험 정보를 확인하기 위해 포인트가 차감됩니다. 사용하시겠습니까.,한성구
이 정보를 확인하기 위해 포인트를 사용하시겠습니까. 포인트를 사용하시겠습니까. 이 시험 정보를 확인하기 위해 포인트가 차감됩니다. 사용하시겠습니까. 이 정보를 확인하기 위해 포인트를 사용하시겠습니까. 포인트를 사용하시겠습니까. 이 시험 정보를 확인하기 위해 포인트가 차감됩니다. 사용하시겠습니까. 이,한성구
이 정보를 확인하기 위해 포인트를 사용하시겠습니까. 포인트를 사용하시겠습니까. 이 시험 ,한성구
편해서 생각없이 수업나가다가 시험기간에 광탈함 너무 편해서 난 딴짓해서 망함 열심히 들으면 좋움,김기
개꿀수업입니다... 명상 잘하시면 됩니다! 시험도 한자 필요없고 걍 해석할줄만 알면 됨 ㅎㅎ,김기
개꿀!!!!!!시험도 조금만 외우면 되고 과제도 별거 아님. 걍 학점 퍼주는 교수님. 부담 거의 0,김기
편히 들을 수 있는 수업이에요.,김기
한자 잘 모르는 사람은 시험기간때 힘들어요.물론 전 아니었지만...ㅎㅎ,김기
이번에 새로 생긴  강의라서 걱정이 많았는데  막상 수업 들어보니 이분이 논어중 최고인거 같음. 수업 편하게 듣고 과제 부담도  없고 시험도 전날 잠깐 보면 됨,김기
에세이가 중요한데 에세이를 조져부렸네? 그리고 기말은 다 잘봐서 의미 없으니 에세이 잘쓰세요,서근식
에세이 잘 쓰면 학점 잘나오는거 같다 기말은 개꿀이라 1시간만 공부하면 다 맞음,서근식
조별활동은 그냥 감점만 안 당하면 된다,서근식
중간안봐서 좋아요,서근식
에세이 좀 오래걸리니까 미리해두시고,서근식
토론발표 3번했지만 점수는 그렇게 크게 반영 안되는듯,서근식
기말도 쉬움,서근식
중간고사가 없다는게 정말 좋은것같아요 그리고 기말고사도 몇문제는 알려주시고 범위 좁게 설정해주시기 때문에 그 부분에서 강조하셨던 것만 조금만 보고 가도 잘 볼수있ㅇ 습니다. 사실 저는 수업때 진짜 설렁설렁 했는데 정말 꿀이었어요 별거 한것도 없는데 성적이 잘나와서 놀라웠습니다..!  꿀이에요 추천할게요!,서근식
정말 좋은 수업입니다 교수님도 친절히시고 재밌고 과제나 여타 귀찮은게 없어서 좋아요 팀별 토론은 수업시간에 하는거라 부담없고 잘하면 좋지만 저는 팀 발표 한번도 못하고도 에이쁠 받았어요 학점은 무조건 채워주신다고 첫시간 말씀하셨고 중간고사는 에세이로 대체입니다 기말준비 잘하시고 중간고사 에세이 충실하게 하시면 성적은 잘나와요 들으세요,서근식
교수님 자체는 좋으나 커리큘럼이 조금 대책이없다고 해야하나? 제대로 확실하게 정한 거 없이 그냥 실험적으로 해보는 느낌이 강했음 토론에 자신있다면 좋은 점수 받을 수 있는데 학점 잘따보겠다고 양학오는 명륜사람이랑 전투민족처럼 말도안되는걸로 딴지거는 사람들이 분명 있을것이기에 좀 힘들수도 있음. 시험 난이도나 그런건 상당히 쉬운편에 속하므로 발표 눈딱감고 두세번 하겠다 하면 좋은강의임,서근식
"전체적으로 매우 만족하고 있는 수업입니다. 교수님이 귀여우신 면모가 있으신데 그로인해 수업이 지루하지도 않구요. 중간은 에세이로 시험대체라서 미리 써놓으면 꿀이고요. 기말시험은 논술형이긴 한데  미리 절반 이상 문제 알려주시고 나머지도 수업때 다룬 내용만 내시기 때문에 푸는데는 큰 아려움은 없으실 겁니다. 단 매 수업마다 조별토론을 하고 보고서를 작성하여 발표자를 정하는데 이게 좀 중요합니다. 매수업마다 10조 중에서 3조가량 발표기회를 얻는데, 짧은시간동안 교수님의 이목을 끌 흥미로운 토론 주제를 잘 장해서 발표자로 선정이 자주 되는 조가 에이쁠 가져간다고 보면 됩니다. 그렇다고 조원끼리 미리 만나거나 할것까진 없고,  그저 조원끼리 잘 맞고 잘 지내면 자연스럽게 토론도 잘 진행되는것 같습니다. 단 율전수업이었는데 문과분들 꽤 계시고 또 확실히 이분들이 강세이십니다 ㅜㅜ 같은조되면 꿀이지만 다른조라면 조금 얄미울수도...",서근식
"중간고사는 인성 에세이로 대체되었는데, 크게 부담갖지 말고 쓰면 될듯하다. 매주마다 나오는 과제는 없고, 가끔씩 수업 중에 에세이를 써야한다. 그리고 조모임을 하는데, 수업 시간에 모여서 어떤 주제에 대해 토론을 하고 교수님에게 선택받으면 발표까지 한다. 문과생들이 와서 학살한다. 그래도 토론잘 참여하고 교수님에게 질문 많이하면 따로 점수도 주신다. 기말의 경우 약술형 2개 서술형 4개이다. 이중 4문제정도는 알려주는데 이것도 안푸니 공부 좀만하면 된다. 수업도 재밌고 교수님이 이해를 쉽게 도와줘서 수업이 부담되지 않으니 꼭 듣기를 바람.",서근식
정말 교재를 쉽고 명료하게 설명해주십니다. 중간고사는 인성 에세이로 대체했었고 기말고사는 한문제당 10줄 내외로 답안을 작성하는 논술형으로 출제되었어요. 다른 논어 수업과는 달리 매주 책을 한 강씩  요약해가는 과제가 있는데 적응하면 그렇게 귀찮진 않구요. 덕분에 책을 끝까지 한번 정독할 수 있어서 오히려 좋았던거 같아요. 막판에 간단한 토론을 했는데 이때 참여해서 가산점을 받은 분들이 에이 학점을 받기 수월했던거 같아요.  사실 학점을 매기는 방식이 그렇게 납득이 가진 않았지만,서근식
기말이 변별력이 없어서,서근식
 수업 자체는 유익했고 교수님도 귀여우ㅎㅎ셔서 나름대로 재밌게 들은 수업이었습니다.,서근식
매주 책 한장 분량에 해당하는 것을 a4용지에 자필로 적는 과제 입니다.총 10번을  하는 것인데요 성균논어 팀플이 많은데 이것은 매주 해야하는 번거로운 점도 있지만 팀플 싫어 하시는 분은 좋을 것 같아요.하지만 한번당 2점씩 총 20점인데 여기서도 세세히 깎으신답니다. 중간시험은 인성고전센터에서 공모전 하는 주제로 합니다 20점만점이고요 기말은 4문제 찝어주시는데 평소에 수업 잘 들으시는 것을 추천 드려요 교수님께서 하신 말에 답안쓸 내용이 많이 담겨있거든요! 4문제 10줄 내외작성입니다. 수업계획서에는 없었으나 k mooc보고 토론을 하였는데 여기서 가산점을 주시는것 같아요..성실히 하시고 팀플 선호하지 않으시는 분들께 좋은 강의 인것 같아요 그리고 출석은 9시에 칼같이 부르십니다!,서근식
"중간고사는 에세이 대체고, 기말고사는 교안에서 나옴",서강휘
공부할건 많이없고 학점은 잘채워주시는듯,서강휘
교수님 좋음,서강휘
맹자에대해 잘 알고계신다면 굳! 수업은 하나도 안힘들고 좋았습니다! 교수님도 너무 좋으시고ㅜㅜ,서강휘
살아계신 공자님입니다.,서강휘
만약 이 교수님이 강의를 하신다면 망설이지 마세요. 추천합니다.,서강휘
교수님만 좋으심. 과제도 논어 치고는 꽤 많지만 교수님은 다시 뵙고 싶을만큼 좋음,서강휘
저는 별루였어요.....교수님자체는 매우매우좋으십니다! 인성이 아주 좋으시고 좋은자료도 많이 보여주세요 하지만 전 재수강하러가야하기에..,서강휘
논어를 가르치는 교수님이 신부님이라서 놀랐지만 한학기동안 재밌었던 강의. 처음엔 피피티도 안올려주시고 어떤 방식으로 시험을 출제하고 뭘 가르치시는지 방향을 잘 못잡았지만 나중에 기말고사용 자료 따로 정리해서 올려주셔서 너무 좋았다. 과제를 생각했을 땐 내가 왜 이 학점을 받았는 지 이해는 안가지만 감사합니다 교수님.. 기말고사도 극악의 난이도는 아니라 아주 좋았다,서강휘
성균논어 교수님들 중에 최고인 것 같습니다. 논어에 대한 수업보다는 대학생이 갖춰야할 소양에 대한 수업을 자주 해주십니다. 시험도 한번밖에 없고 학점도 잘 주시는 편입니다.,서강휘
교수님이 신부라서 놀랐다 ㅎㅅㅎ,서강휘
 참고로 논어 들을꺼면 이 교수님 수업 추천한다!! 과제는 논어 에세이랑 독후감 그리고 조별발표인데 논어 에세이가 중간대체과제라 요거를 ㅈㄴ 빡세게 쓰고 나머지는 10점정도라 기말과 에세이를 잘 봐야한다.  아 첨언을 하자면 신부님이라 그런지 정치적색깔이 약간 있으시다!! 근데 거북할 정도는 아니니 ㄱㅊ다!!,서강휘
정치적 의견을 많이 표출하시지만 굉장히 인간미 넘치시는 교수님이세요 ,서강휘
그러나 과제와 시험으로 다 판단하시는 것 같은데,서강휘
기준을 말씀을 안해주셔서 어떻게 점수를 내시는지는 모르겠습니다,서강휘
수업시간 다 채운적 한번도 없고,서강휘
그러나 굉장히 좋으신분!,서강휘
기말이 너무 쉬웠는데 그거 하나로 다 정해지고 레포트도 교수님 주관으로 채점해서 학점 예상을 못해요.,서강휘
그냥 단순암기해서 시험치시는걸 선호하시면 절대 듣지 마세요,서강휘
1. 교수님 성격 좋으심. 정말 좋으심. ,서강휘
2. 학생들 의견 적극 반영해주심.,서강휘
"3. 과제는 에세이 하나, 중간 대체 독후감이 있음. 분량 많지 않음. 각 2장",서강휘
3장. 수업 내용이랑 관련도 없음. 그냥 자유롭게 주제에 관련해서 서술하면 됨. 보아하니 기간보다 늦어도 감점을 안하시는듯. 마지막 문장은 참고만하셈. ,서강휘
4. 기말 시험은 교수님이 나온다 한 것에만 나옴. 찝어주는 내용이 많지도 않음. 문제도 매우 쉬움.,서강휘
5. 결론적으로 평소 부담없는 개꿀과목임. 걍 들으셈. 100번 들으셈.,서강휘
목사 아니고 신부님입니다. 좋은 수업이었지만 과제가 부담스러울 수 있습니다.,서강휘
"목사이신 분이  성균논어를 가르치십니다! 교수님은 정말 친절하고 좋았고, 시험도 한번밖에 보지않아 부담스럽진 않았습니다. 수업시간 종종 동영상을 많이 보여주셔서 좋았습니다...",서강휘
시험도 시험일 일주 전에 하시는 요약본 공부하면 다 쓸 수 있습니다. 중간 때 몰아보는 시험의 부담 줄이고싶다면 강추!,서강휘
이 정보를 확인하기 위해 포인트를 사용하시겠습니,서강휘
이 정보를 확인하기 위해 포인트를 사용하시겠습니까. ,서강휘
이 정보를 확인하기 위해 포인트를 사용하시겠습니까. 포인트를 사용하시겠습,서강휘
시험이나 출결같은건 아래분들이 설명을 잘 해주셨군요,임종수
일단 수업에 대한 부담은 거의 없어요 카톡으로 이러이런 일이 있어서 못간다 하면 친절하게 받아주시고,임종수
교수님 인성도 너무 좋아요 종강할때쯤 인간미를 보고 반했답니다,임종수
다만 딴짓하기 너무 좋아서 생각보다 배워갈게 없을수도있어요,임종수
시험도 교안 좀 보고 생각하면 되는거고 과제도 나쁘지않아서,임종수
뭐 전체적으론 낫밷한 수업!,임종수
이냥저냥 하다가는 꿀이고 뭐고 뒷통수 맞고  학기가 끝납니다,임종수
꿀빨수있지만 에이 이상은 받기 힘들다고 생각됩니다.,임종수
"과제도 거의 없는 수준이고, 교수님께서 학생들 얼굴을 외워서 출석을 불러주십니다.",임종수
시험공부에 대한 부담도 매우 적고요. 편하게 들을 수 있습니다.,임종수
17년 여름계절로 수강했습니다,임종수
우선 교수님이 학생들 배려도 많이 하시고 좋으신 분입니다.,임종수
다만 3점을 준 이유는 채점 방식이 모호하고 성적 늦게 올려주셔서 이의제기도  못합니다,임종수
과제는 자서전 쓰기 하나 있었고 중간안보고 기말만 봅니다,임종수
시험 단답형 주관식 5문제랑 서술형 두세문제정도 나왔는데,임종수
주관식 하나 못쓰고 서술형 꽉채워서 썼는데 씨쁠나왔습니다.. 다들 열심히 하시는듯,임종수
암기보다  논술형 좋아하시면 들으세요!,임종수
교수님은 착하신분입니다. 출석체크하는데 결석해도 자기 사정만 카톡으로 교수님께 말씀드리면 출결점수 안깎는것 같더라고요.  재미있게 수업을 들었지만 다른 분들이 말씀하신 것 처럼 수업이 산으로 가서 진도가 안나가 답답할 때가 좀 있었습니다. 그래도 많은 것을 배운 수업이었습니다.,임종수
교수님이 정말 최고이십니다. 무엇보다 학생들에 대한 존중과 사랑이 넘치십니다. 다만 손에 잡히지 않는 내용을 싫어하시는 분들은 잘 안 맞으실수도 있습니다. 그것 빼면 어떤 면에서든 최고입니다. 다 끝나고나면 수업 내용 뿐만 아니라 교수님이라는 사람이 남는 수업입니다. 그리고 팀플과 발표가 없는 점도 짱,임종수
엄청착하심 과제기한 거의 한학기 주셔서 부담없음 지각해도 나중에 출석확인할 수 있음 시험은 좀 막막했는데 그냥 내생각잘쓰고 나오면 되는것같음 그냥 부담없이 논어 수업 듣고싶으면 추천함 수업시간에 하나도 안들어도 뭐라안하심 출튀도 좀 있던데 그리고 공시기간에 안올려주셨다고 하신분들 많은데  이번엔  부친상때문이라고들음 학점기준은 잘 모르겠음,임종수
17년 여름 수강자입니다. 교수님이 일단 성격 엄청 좋으시고 학생들 생각을 굉장히 많이 해주시는 것 같습니다. 학생들 이름도 다 외우시고 말씀하시는 거도 굉장히 감수성이 풍부하신게 느껴져서... 다만 아랫분 평가는 백퍼 공감입니다. 반영비율 같은거 없고 수업 산으로 가고 ,임종수
저는 그래서 막판엔 거의 안들었습니다,임종수
 성적 공시 기간도 안지켜주시고 근데 저는 좀 기억에 남는 수업을 원했던 게 아니라 그냥 졸업요건 채우고 학점 따려고 들었던거라 수업 널널하시고 특별한 터치 없으셨던게 좋았어요 걍 수업시간에 폰질해도 된다고 대놓고 말씀하실정도,임종수
 물론 뒤로는 태도 점수 어떻게 매기셨을지 모르겠지만 저는 에이쁠 받았구요 과제는 분량을 굉장히 넉넉하게 냈습니다 분량 제한도 없다시피하고 시간 기한이 의미 없으리만치 주시기 때문에 생각을 많이 했다는 게 드러나는 글을 좋아하십니다.  시험은 엄청 종잡을수가 없어요 그냥 막 예란 무엇인가 학문이란 무엇인가 이런식인데 전 그냥 논어 구절 외운거 다 때려박고 해설해서 논술 쓰듯이 썼습니다. 교수님이 ,임종수
공부하는 게 드러나면 좋겠다. 그런데 외울 필요는 없다.,임종수
 라고 말씀하시는데 안외우면 공부하는게 안드러나니깐 책이든 교안이든 외우세요 엄청 남는 수업은 아니고 그냥 암기 잘하고 글빨 잘 털면 수업 안들어도 되는 꿀강입니다 근데 학기중에 듣고 싶진 않네요 계절한정꿀강...,임종수
17년 여름 수강자임. 다들 5점 날리는데 나는 1점 준다.,임종수
"일단 실라버스가 없다. 시험 한 번 보고, 뭐 자서전쓰기, 기말 하나 있는데, 그것도 중간에 교수님이 그냥 정한거고, 정확히 반영 비율 이딴거 말 안 해준다. 출석은 한명씩 호명하고, 지각해도 깎이고 그런거 없어서 그건 뭐 좋다고 생각하면 좋을 수도.",임종수
수업은 좋게 나가다가 산으로 종종 감. 자기가 가르치는 다른 중고등학생 안타까운 사연으로 넘어감. 개인적으로 별로.,임종수
"학점을 매기는 기준에 관해, 4학년이면 재수강할 수 없다는 걸 이야기하면서 한상 학점 줄 때 마음이 아프다고 처연한 표정 지으면서 말씀하시는데 그럴때마다 어이가 없음. 그냥 주시라구요. 기준대로.",임종수
가장 빡친거. 왜 성적공시 기간에 성적을 안 올려 주냐고.,임종수
시험은 기말고사만 치는데 문제는 10문제 중 3,임종수
5문제 서술하면 됐구요. 논어의 개념이나 조금 응용해서 서술하는 문제들로 구성돼요. 수업을 잘 듣고 조금만 공부하시면 잘 쓰실 수 있다고 생각해요. 교수님이 학생들을 상당히 배려를 많이 해주세요. 과제는 3개였는데 자서전 쓰기와 마음에 와 닿은 논어 3,임종수
5 구절과 이유쓰기와 사회적 문제 쓰기 이렇게 3개 있어요. 사회적 문제 쓰기의 경우 중간고사 때 초고를 써서 그렇게 시간이 많이 들지는 않았어요. 과제 제출 기간이 길어서  여유있게 하실 수 있으실 거에요. 열심히만 한다면 충분히 학점 잘 받으실 수 있으실 거에요.,임종수
"에타나 배남주 어디에서도 대체 시험이 어떻게 나오는지 아무도 안알려줘서 짜증이 났었는데요. 다음 학기에 들으시는 분들은 저같은 번거로움 겪지 않으셨으면 좋겠습니다. 이전까지는 어떻게 내셨는지 몰라도, 이번에는 중간고사를 레포트로 대체하였고 기말고사는 약 10개남짓 되는 문제를 주시고 그중 최소 3개, 최대 5개를 선택하여 답안작성하게 하셨습니다. 문제 중 30",임종수
40퍼센트 정도는 논어 구절이나 개념을 숙지해서 써야하는 문제였구요.,임종수
사단과 사덕의 종류와 의미를 서술하시오 같은거요,임종수
 나머지는 현대 사회에 가장 큰 문제가 무엇이라 생각하는지 쓰고 그것을 논어의 어떤 개념,임종수
정신? 태도?같은거요,임종수
으로 해결할 수 있는지 쓰시오. 또는 유학에 따르면 인간은 평등한가?  이런 식으로 거의 논술하듯이 쓰라고 하는 문제들이 좀 더 많았던 것 같아요. ,임종수
"과제는 자잘하게 자서전쓰기,  현대사회 문제에 대해 논어구절과 연관지어 쓰기, 우리들의 세상 논어로 보다 읽고 독후감 등 자잘하게 있지만 워낙 기한이 무의미하리만치 관용을 베풀어주시기에 큰 부담 없으실 것입니다. 교수님께서는 학생들에 관심이 매우 많으시고 정말 인간적이고 다정하신 분입니다. 만약 이런 출제스타일이 지속된다고 가정했을 때, 제가 생각하기에 수업시간에 들은 내용들 기본적으로 숙지하시고, 중요한 개념 익혀서 좀 실천적인 부분들에 응용만 할줄 알면 어렵지 않을 것이라 생각합니다.",임종수
교수님이 생불이십니다. . .1교시라 힘들었는데 출석도 부르기만 하시는것 같더라구요. . 과제도 간단한 자서전 쓰기  하나였습니다.  근데 시험은 어떻게 평가를 하시는지 잘 모르겠습니다.  약술형 몇개에 논술형을 섞어내시는데 1교시라 많이 졸아서  약술형을 많이 놓쳐서 씨뿌리길 기대했는데 예상외로 비플을 주시더라구요,임종수
정말 좋으신 교수님 입니다 . 팀플과 발표 싫어하시는 분들 정말 추천합니다!! 수업도 부담없이 이야기 듣는 방식의 수업이구 과제도 많지 않습니다. 학생의 편의를 싱각해주시구 학점도 매우 잘주십니다. 교수님이 학생의 이름도 다 외워주시는데 시험을 잘보는게 중요한 것 같습니다. 출결은 부르시긴 하지만 반영하시지 않는 것 같습니다. 매우 추천합니다.,임종수
"교수님 인간미 넘치심 ㅠㅠ 학생들한테 애정도 많으신 듯! 과제는 자서전 쓰기, 논어 구절 중 가슴에 와닿은 구절 3",임종수
"5개에 대해 왜 그렇게 느꼈는지 쓰는 거 있었어요! 시험은 기말만 봤는데 서술형이에요! 기본적인 개념만 알아두면 충분히 쓸 수 있는데, 그래도 깊이 있게 쓰려면 평소에 수업 들어두는 게 도움돼요",임종수
 그리고 기말고사에 포함되는 한 문제는 교수님이 미리 알려주셔서 시험 전에 작성해서 이메일로 제출하도록 하셨어요! 그 문제는 시험이지만 과제 같은 느낌!,임종수
교수님이 수업에 열정적이시고 수업을 열심히 듣는 학생을 선호하심. 학점도 교수님이 주실수있는 선에선 최대한 채워줌. 기말과제를 내주셨는데 제출자가 한명이었는데 교수님이 학생들 부담된다고 없애주심.  혼자 제출해서 에이플 받음. 수업시간에 열심히 들었다면 에이 이상은 가볍게 받음. 수업시간에 안자고 열심히 수강하는 사람이라면 학점 잘나올 과목,임종수
교수님이 수강생전원 얼굴과 이름을 외울정도로 열정적이십니다 책도필요하고 직접제작한 프린트물로 수업하시고 과제는 글쓰기 과제를 주로 내주십니다 중간시험은 보지않았었고 기말만 쳤습니다 주제를 주시면 그에 맞게 글을 써내는 것입니다 외울 것도 없고 준비도 하진 않았구요 A는 어려워도 부담은 크게 안되서 좋았습니다,임종수
좋아요! 좋은데... A따기는 힘들듯... 근데 정말 좋음... 그냥 비쁠까지만 노린다면 핵추천,임종수
채점방식이 미지의 세계라는 것이 단점!,임종수
"첫 시간에 출결 반영 안한다고 하셨고, 부르기는 하나 그냥 확인하는 것 같음. 맨 처음 과제가 자서전 쓰는 거였고, 두 번째 과제는 교재 읽고 요약?해오기. 중간고사는 주제를 주고 종강 전까지 제출하는 과제로 대체. 기말고사는 현장에서 써서 제출하는 시험이었음. 수업은 매주 강의 자료 올려주시고 두시간 수업 하시는데 듣기 편안함. 공자왈 맹자왈 이런 딱딱한 수업 예상했는데 좋은 경험이었다고 생각함. 성적에 대한 기준은 모르겠음. 평가할만한 게 과제 두 번이랑 시험 두 번 뿐인데. 다 에세이 작성하는 작문이라.. 읽어보고 평가하시는 듯. 다 잘 썼는지 성적 잘 받았음.",임종수
학점어떻게주는지를모르겠어요,임종수
근데 정말 좋으신 분입니다,임종수
너무 착하십니다,임종수
다른 논어와 다르게 조별도 발표도 없고 너무 좋습니다,임종수
