Feedback,professor
" 지각 절대하지마세요ㅠ 논어과목자체가 점수 차이를 크게 낼수있는  게 아니라서 지각이나 결석하면 점수가 훅 깎일거예요!저는 진짜 발표하고 토론하는 수업방식이 너무 재밌어서 참여열심히하고, 시험준비도 무난하게 하니까 에이쁠 떳어요! 비율은 다 채워주시는거같아요!! 다른 학우들의 생각들을 들을수있어서 재밌었고, 교수님이 너무 좋으셔서 ..ㅠㅠ 다음에 청강이라도 한번 하고싶어요",김세종
! 추천합니다!!,김세종
교수님이 학생들을 존중해주시는게 느껴지는 수업. 과제 주제도 학생들과 상의해서 학생들이 더 관심 있는쪽으로 정해주심.  시험은 한문 해석과 생각쓰기가 있는데 준비하는 데 오래걸리지 않으며 한문 해석만 좀 외워가면 다 쓸 수 있음. 생각쓰는 논술형문제는 자기 생각을 논리적으로 펼칠 수만 있으면 됨. 이번학기에는  5분 내외 개인 발표 1번과 다른 학생의 발표에 의견을 제시하는 토론 2번이 필수 였음. 발표문은 미리 아이캠퍼스에 올려놓아야 하고 토론은 수업시간에 하기 힘들면 발표문에 댓글로 달면 됨. 성균논어는 김세종 교수님 수업으로 듣는 것을 추천!,김세종
교수님 마음이 너무 따뜻하십니다. 학생들에게 관심도 많으시고요. 학생들과 토론,김세종
정식 토론이 아니라 발표 듣고 문답,김세종
 위주로 수업을 나가는데 다른 학우들의 생각도 들을 수 있고 교수님께서 생각 들려주시는 게 특히 유익했습니다. 단순히 논어 자체로 수업하지 않아 좋습니다.,김세종
교수님의 견해를 들을 시간이 더 많았으면 하는 아쉬움이 살짝 있긴 합니다.,김세종
"정말 4학기 다니면서 최고로 좋은 교수님이셨습니다. 학업부담도 거의 없고 교수님이 학생들을 정말 잘 배려해주십니다. 학생들에게 거의 부담스러울 정도로 존중을 표하십니다. 인간적인 존경심이 들 정도로 좋으신 교수님입니다. 중간, 기말 때 한자 외우는 것이 좀 부담스럽긴 하지만 한자만 달달 외워가시면 시험 자체는 평이합니다.",김세종
반수하면서 듣느라 진짜 공부도 많이 못하고 수업 참여도 많이 못했는데 비쁠 나왔어요! 좀만 공부하면 다 쁠달아주셔서 에이쁠 달기도 쉬울 것 같습니다. 시험도 평이하게 나오고 수업도 발표 한번 토론 두번만 하면 되서 어렵지 않아요. 그리고 논어 내용을 머릿속에 막 집어 넣는 그런수업이 아니라 논어 책을 토대로 생각해볼 거리도 많아지고 교수님의 의견 제시도 도움이 많이 됩니다. 교수님 성격도 무지 좋으시고 강추해요. 말그대로 교양수업이고  부담 없는 수업입니다!,김세종
수많은  논어수업 중에서 김세종교수님의  논어수업을 들은건 이번 학기 최고의 행운이 아닐까 생각이 들 정도입니다. 학점 과제 등 모든 것을 떠나서 나 자신을 돌아보고 다른 사람의 생각을 들어볼 수 있는 소중한 시간이었습니다. ,김세종
지나가던 에이쁠이,김세종
진짜 갓세종님이세요.. 무조건 들으세요!,김세종
"저희는 토론2, 발표1, 과제1, 시험2 이렇게였는데",김세종
과제는 인의예지 관련해서 자유롭게 주제 선정해서 에이포 한페이지정도만 쓰면 되구요 ,김세종
토론이라는 것도 수업시간에 다른 학우분들 발표하시는 거 듣고 손 들고 질문하시거나 추가의견 자유롭게 말씀하시면 됩니다.,김세종
만약 부끄러우시다면 아이캠퍼스에 글로 쓰시면 돼서 절대 부담감 없으실거에요!,김세종
"발표는 출석부 순서대로 매주 5명씩 하는데, 많이 준비해야하는 것 없고 성균 논어 교재 ",김세종
 교수님이 제시하시는 생각할주제 ,김세종
"아이캠에 올려주세요, 매주 달라져요",김세종
에 따른 자신의 내용을 자유롭게 말씀하시면 돼요. 이 또한 한 학기에 한 번 밖에 없어서 별로 부담감 없어요! 정말 부족한 발표여도 교수님은 좋다고 말씀해주시고 귀 기울여주십니다 천사세요 진짜.. 학생들을 정말 배려 많이 해주시고 존중해주십니다.,김세종
"시험은 중간 기말 다 있구, 논어 내용 한자 해석 ",김세종
 서술형 이렇게 나와요! 둘 다 어렵지 않으실거에요 한자는 그냥 달달 외우시면 되고,김세종
중간 때 무지 쉬웠고 기말은 평범했어요,김세종
", 서술형은 자신의 생각 정성껏 쓰시면 돼요ㅋㅋㅋ 어려운 문제 안나오구요! 수업 시간 때 했던 내용이랑 비슷하게 나오니까 걱정 마세요.",김세종
여러분 논어는 무조건 이 교수님꺼 들으세요 ㅠㅠ 저희는 영화도 보여주셨었구요! 한 학기에 한 번 결석 찬스도 있었어욬ㅋㅋㅋ 강추합니다,김세종
!,김세종
갓세종님 성균논어를 씹어드셨습니다.  매우 친절하시고 수업도 유익하고 재밌고  과제 토론 등도 많지 않아 편하고 시험공부하기도 많이 수월하고 학생들 배려도 많이 해주십니다. 이만 지나가는 씨쁠이,김세종
"교수님께서 학생들을 많이 배려해주십니다. 밑에 분이 쓰신 것처럼, 학생들을 한 명 한 명 독립된 인격체로 대해주세요! 그리고 수업구성에 있어서도 학생들에게 참여의 여지를 많이 남겨주세요.. 정말 민주적이고, 자율적입니다. 수업시간에 참여를 많이 할수록 점수를 잘 주시는것 같아요ㅎㅎ 아 그리고 가끔 청강하러 오시는 분들도 있어요!. 과제도 재미있어요. 특정 주제에 대한 글쓰기가 대부분인데, 자기 생각을 정리하기도 하고 이걸 발표해서 수업시간에 타 학우분들과도 의견을 교환할수 있어 좋아요. 시험은 한자를 좀 알면 진짜 편해요. 논어 구절 해석하는 시험인데, 암기를 위한 암기도 아니라 왠지 이거 중요한것 같다 하는 부분이 주로 나옵니다. 자잘하게 안 나와요. 나머지는 특정 주제에 관한 글쓰기, 논술형입니다. 이 부분은 조리있게 본인 의견을 풀어 쓰면 됩니다. 쉬워요!  이번학기 들은 교양과목 중 최고!",김세종
정말 학생들 한명한명을 독립된 인격체로대해주시는 느낌! 진짜 배려많이해주시고 수업도 편해요ㅎㅎㅎㅎ중간기말은 논어구절해석문제,김세종
 자기생각논술한문제 나오는데 중간은개쉬워서 제생각엔 20만점에 중위값이 18.5는 됐을듯..화이부동 이런거나왔어요ㅋㅋ그래서그런지 기말은 약간,김세종
정말약간,김세종
어려운 문제 나왔어요! 진짜추천합니다 어차피 졸업하려면 논어들어야하는데 이 교수님거 들으세요!,김세종
학점도 잘채워주시고 초임교수라서 그러신지는모르겠지만 학생들의 마음을 정말 잘 배려해주시고 헤아려주십니다.,김세종
학생들을 너무나 배려해주시고... 존중해주시는 교수님입니다,김세종
학점은 무조건 플채워 주시고 과제는 중간에 글쓰기에세이 하나 있는데 그마저도 영화를 보고 감상문 쓰는것으로 대체하였습니다,김세종
그리고 전 학생을 대상으로 2달에 한번씩 발표가 있는데 논어구절을 토대로 자신이 생활속에서 느꼈던 경험이나 느낀점을 솔직하게 말하면 됩니다,김세종
복학 후 들었던 수업들 중 단연 최고라 꼽을 수 있을만한 수업입니다.,김세종
"교수님 괜찮고 그런데  초반에 태도점수 없다고 했는데 후반엔 평가하겠다고 말바꾸시는데 좀 그랬네요. 점수 폭 차도 거의 좁아서 출석 중요해요,",김세종
초임교수여서 조금 미숙한 점이 있었지만 학생을 위해서 언제나 애쓰시는 모습이 좋았습니다.,김세종
학점 잘주십니다,김세종
교수님이 진짜 착하시다 대학생활 3년 중에 이렇게 착하신 교수님은 본적이없다,안승우
정말 싫은 소리 하나도 안하시고 최고중에 최고인 교수님,안승우
2학년 1학기때 수강하긴했지만 겪어봤던 교수님 중에 누구보다 착하시고 누구보다 학생을 위한 마음이 크신 분이였습니다,안승우
대학교 교수님 보단 고등학교 선생님처럼 학생을 위한 수업을 하시는 교수님계의 교수님 같습니다,안승우
논어를 들어야 하시는 분이 계시다면 이 분 수업을 꼭꼭꼭 들으시길...,안승우
학기가 끝나는게 아쉬웠다고 생각이 든 교수님이었습니다,안승우
"교수님 ㅡ착하시고 학생들을 최대한 배려해서 싫은소리 안하신다. 근데 이걸 역이용해서 뒤에서 자거나, 다른 과목 과제 자주 하던데. . . 머 이것도 누군가들에겐 장점이라면 장점이겠지만 자제하자",안승우
과제ㅡ중간에 에세이 쓰면 되는데 거창한거 보단 본인의 경험과 접목하는걸 강조하셨다,안승우
"팀플ㅡ인의예지. 중 하나 선정해서 관련된 사업이나 봉사단체나 시스템 개발,어플, 제품 등등 기획 하기인데 4차산업혁명과 관련된거",안승우
"어플, VR, 로봇, 인공지능 등등",안승우
로 논어 엮으면 좋아하신다. 그리고 발표 후 Q,안승우
amp,안승우
A때 매번 질문하는게 좋다,안승우
"시험ㅡ중간기말 두번, 걍 피피티 암기인데 어떤 사자성어나 공자나 맹자 등등의 어떤 일화가 담고있는 논어의 사상도 같이 알자",안승우
출첵ㅡ매번 부르신다 위에서 말한 교수님의 착한심성을 간파해 출튀하는 사람들도 많은데 중간에 다시 또 부르신적 있다 다들 탈탈 깎였었다,안승우
진짜 착하시다. 수업은 사실 재미없어서 잘 안들었지만 너무 착하셔서 계속 마음이 불편하고 죄송했다. 배우는 내용은 그냥 책 내용 그대로 배운다.,안승우
시험은 아캠에 올려주시는 ppt에서 전부 나온다. 시험 하루전에 글자하나하나 통째로 외우면 다 맞는다. 자기 의견 물어보는 서술형도 있는데 그거는 그냥 성의껏 잘 쓰면 된다.,안승우
팀플은 인의예지 중 하나 골라서 그 주제로 사업 아이템 같은거를 구상해서 발표하는 거였는데 부담없이 할 수 있다.,안승우
과제는 평천하에 대한 에세이 쓰기였는데 하루 날 잡고 쓰면된다.,안승우
사실 수업내용도 기억에 남지만 그것보다도 교수님의 성품과 행동에 논어의 가르침이 녹아있는 것 같다.,안승우
다른 논어 수업 광탈하고 시간 맞는 수업이여서 그냥 들었는데 매우 좋았음. 과제도 개인과제 1개 팀플 한 번 있는데 팀플 부담 없음.,안승우
중간 기말 출첵 잘 하면 학점 잘 주시는 듯.,안승우
마지막 수업 날 초코파이도 나눠주시고 드립이 재미없지만 수업 재밌게 하려고 노력하시는 엄청 좋은 교수님임.,안승우
조원들 학점 보면 비율 꽉 채워주시는 거 같음.,안승우
이번학기에 논어를 들으려고 봤는데 적당한 시간대가 이분 수업밖에 없어서 들었다. 결론부터 말하자면 좋았다. ,안승우
" 성균논어 자체가 우리 성대생이 꼭 들어야 하는 수업이라고 생각한다. 우리가 살아가면서 지켜야 할 도리들, 인생의 진리들이 모두 유학에 담겨있다. 안승우 교수님의 수업을 들으면서 이 점을 확실히 느꼈다. ",안승우
 솔직히 이분 수업이 아니었어도 스스로 공부하면서 느끼지 않았을까 하는 생각도 있지만 아무튼간 꼭 들어보길 바람. ,안승우
 논어 강의를 처음 하는 분이라 강평이 하나도 없는 게 좀 불안했지만 일단 교수님 매우 착하시고 ,안승우
드립은 노잼이긴 하지만,안승우
 수업도 듣는사람 거의 없지만 집중해서 들으면 얻어갈 것 많다. 학문적으로가 아니라 인간적으로. 논어가 그런 수업이다. 인간으로서 수업 꼭 듣자 얘들아. ,안승우
 팀플이 한번 있다. 그러나 별로 부담스럽지 않다. 어떤조는 한번도 직접 만나지 않고 모두 단톡에서만 해결했다더라. ,안승우
 학점은 초임강사 종특은 어쩔수없는지 그닥 좋게 주진 않으셨다. 그래도 초임치곤 그나마 잘준듯. 어쨌든 난 추천한다.,안승우
참고로 교수님 여자임,안승우
수업도 좋고 시험도 어렵지 않아서 좋음.  단지 조별과제가 처음 시작할때 난해함,안승우
논어계의 천사가 있다면 바로 안승우 교수님. 과제는 논어 에세이와 조별과제가 있습니다. 중간고사 기말고사 잘 보면 학점 잘 주시는 것 같습니다. 수업이 지루하지 않고 강의력이 좋으십니다. 책 없이 피피티로만 공부해도 됩니다. 시험도 나올 것 같은 것만 나옵니다. 조별과제에는 크게 부담느끼시지 않아도 됩니다. 교수님께서 강의하실 때 열정적이셔서 좋았습니다.  왜 고민하나요? 안승우 교수님이 계신데,안승우
논어에 대해 실생활과 관련해 예시를 많이 들어주시고 수업도 열심히 하시고 집중해서 들으면 얻어가는게 많다. 시험도 쉽다. 과제도 별로 없다.,안승우
좋고 편안한 교수님입니다. 알아서 어느정도 하면 좋은 성적 받으실 수 있을 겁니다,김종석
학생의 편의를 많이 봐주시는 교수님이세요 과제는 에세이 하나 내는 거였고 팀플도 기말쯤에 한번 있긴하지만 그렇게 부담이 되는 편은 아니에요 시험도 요약본 올려주셔서 하루전에 읽고 조금 외웠더니 점수 잘나왔어요 완전 추천합니당,김종석
"비록 제가 과제 제출일을 착각해서 늦게내고 기말고사를 던져서 학점은 비쁠이지만 굉장히  편한 수업인건 분명합니다. 팀플도 부담이 없고 과제도 글 하나 내면 되고, 프린트에 요약해주셔서 공부하기도 편해요.",김종석
교수님이 정말 착하셔요! 수업은 거의 항상 꽉 채워서 하시긴 해요.,김종석
과제는 글쓰기 하나랑 팀플 하나랑 있어요.,김종석
시험은 중간때는 주관식과 서술형이었는데  기말때는 서술형뿐.,김종석
사실 교안이 주어져서 그것만 봐도 돼요.,김종석
교안에서는 용어 및 한자성어 위주로 보세요.,김종석
그냥 무난한 논어수업인듯 교수님은 좋으심 시험은 교안 다 외우면됨,김종석
수업은 지루하긴하지만 시험은 논술형이라서 부담없고 교수님께서 착하시고 좋아요 조프로젝트도 그렇게 많이 부담되지 않습니다  학점도 쁠 잘달아주시는것 같아요 좋아요,김종석
제가 수업을 잘 안들어서 뭐라고 못하겠지만 주변을 보니까 교수님이 학점을 잘 받을만한 사람은 잘 주시는거같아요,김종석
인의예지에 관해서 빌표하는 팀플 한번 있고요 시험은 프린트만 전부 외우면 무난하게 풀 수 있어요 열심히만.하면 a,김종석
는 무난한 것 같아요,김종석
교수님은 진짜 천사입니다 핵착하고 핵좋아요 시험기간에 피피티 올려주시면 책한번읽고 피피티 보고 중간기말 시험보면되요 교수님이 막 외우고 세세한거 내는거 별로 안좋아하시는 것 같숩니다 서술형으로 크게크게 내요 팀플은 체험하는거 있는데 체험에 의의를 두고 피피티만들어서 발표하면 되요 이것도 크게 변별력이 있진 않아보여요 교수님이 플도 다채워주시고 착하고 완전 그냥 천사임 논어들을사람 꼭들으세오진짜,김종석
저는 중간고사 때 평균보다 1점? 정도 높았고 팀플 열심히하고 기말 서술형 거의 끝까지 남아서 썼구요. 에이쁠 나왔습니당,김종석
 수업 자체가 부담이 있는 수업은 아니구 시험 전에 올려주시는 요약본 몇번 훑어보고 시험치면 학점 잘 나옵니당,김종석
 저는 명륜인데 명륜에서 오신분들이 꽤 많더라구요. 팀플하면서 율전 분들이랑도 친해지고 좋았던 것 같아요,김종석
추천합니다,김종석
예상한 것보다 학점이 잘 나온 수업이에요. 중간 때 평균 조금 넘었었는데 팀플 열심히하고 기말 때 서술형 혼신의 힘을 다해서 썼더니 에이쁠 나오네요. 교수님이 학점 비율 잘 채워주셔셔 그런거같아요. 자과캠수업인데 명륜사람 많아요. 그치만 명륜이라고 잘나오는건 아닌듯요,김종석
 수업은 조금 지루하지만 교수님이 학생들 생각하면서 애써주시는게 너무 느껴져요. 김종석교수님은 사랑입니다.,김종석
시험: 중간은 주관식단답,김종석
서술형 으로 진행되었고 기말은 서술형4문제로 진행되었어요! 시험2주정도전에 요약집올려주시는데 그것만 제대로 보면 에이쁠입니다!!! 책을 한번쯤 가볍게 읽는것도 좋을거같긴해용,김종석
과제: 중간고사쯤에 에세이쓰는 과제가 있었구요 조별과제가 하나있습니다. 조짜는건 교수님께서 해주시구 인의예지 중 하나를 주제로 주십니다 8인1조로 진행되는데 직접체험해보는걸 중시하세요! 일정수준만해도 감점은 없는듯합니당,김종석
학점: 쁠다채워주시는교수님으로 유명하세요!!,김종석
개인적으로 김종석교수님 논어 굉장히 추천합니다,김종석
"우선 이번학기 기준으로 팀플 1회와 과제 1개, 중간",김종석
"기말 로 구성되었습니다. 과제는 거의 모든 논어 분반 공통과제고, 제출만 하면 감점은 없는 것 같아요. 팀플과제가 60명을 8조로 나누다 보니 인원이 좀 많습니다ㅠ 그리고 체험을 요구하기 때문에 살짝 까다롭긴 해요.. 그런데 참여만 하면 역시 감점은 없는 것 같아요. 즉 제일 중요한건 두 번의 시험인데  김종석 교수님은 시험 1",김종석
2주전에 교안의 핵심내용을 정리해서 아캠에 올려주셔요. 한 10페이지 내외 분량인데 그것만 달달 외운 뒤 잘 응용하여 쓰면 됩니다! 외울 때는 키워드 위주로만 외우면 되서 시험 준비도 오래 안걸려요,김종석
 1시 시험이라 시험당일 새벽에 일어나서 외웠는데도 다 외웠어요. 단 시험 성적은 비교적 따닥따닥 붙어있어서 실수하면 위험해 보이긴 하는데.. 국어 짱 못하는 율전러가 명륜사람들의 침공에도 불구하고 A,김종석
을 받은 걸 보니 할 만한 과목이라 생각해요 ㅠㅠ 갓종석 교수님 진짜 사랑합니다,김종석
수업관련해서는.. 말 하시는게 조금 느긋느긋하셔서 수업이 지루하게 느껴질 수도 있는데 교수님이 그럴 때 마다 간간히 영상자료도 보여주셔서 정말 재밌게 수업을 들었습니다. 다들 김종석 교수님 수강성공하시고 행복하게 2학점 채워가세요!!!,김종석
외쳐 갓종석....수업시간에 그냥 정말 앉아서 세미나 온 것처럼 듣기만 하고 웃고 간 기억뿐인데 중간기말 5시간씩 공부한 내게 에이쁠을 주신 교수님은 갓갓갓 이수업으로 120학점을 채우지 못한 것이 못내 아쉬울 뿐이다.,김종석
중간에서 평균보다 낮은 점수였지만 기말에서 썰풀이를 최후의 5인까지 남아서 했더니 에이쁠이 뜨는것이어따....사랑합니다 갓종석,김종석
요약:기말 논술이중요,김종석
교수님도좋으시고학점도잘나옵니다.,김종석
강추,김종석
교수님 성격도 좋으시고 다 좋음...,김종석
시험준비하라고 자료 올려주신거 외운다고 외웠으나 성적은.....ㅎㅎㅎ,김종석
그냥 논어라는 과목자체가 나와 맞지 않는 과목이라 생각하련다... ,김종석
재수강은 생각도 안한다!,김종석
2016년 여름계절학기 수강함. 교수님 되게 좋으시고 학생들을 정말 많이 생각해주세요. 성적도 플러스 꽉 채워주신다고 하심.. 학점은 시험으로 갈립니다. 중요 키워드 위주로 암기하세요,김종석
다 필요없다. 계절은 닥치고 갓 종 석 ,김종석
갓,김종석
종,김종석
석,김종석
갓,김종석
무난한 논어수업.,김종석
과제 1번 팀플1번  시험2번으로 되어있다.,김종석
수업은 조금 지루하다. 피피티기반으로 나긋나긋 말씀하셔서 루즈해진다. 교수님이 요약본을 시험2주전에 올려주시는데 거기에서 시험이  다나온다. 그것만 달달외우면  됨.,김종석
다른 논어에 비해 부담 없는듯. 시험도 요약본 나눠주시는거 달달 외우면 끝,김종석
교수님 너무 착하심.,김종석
시험도 요약본 올려주셔서 개꿀..,김종석
교수님 사람이 너무 좋으심ㅠㅠ,김종석
9시 수업이었는데 학생들 배려해주셔서 30분까지 기다려주심ㅠㅠ,김종석
한 번씩 하는 팀플 발표,김종석
토론도 교수님이 토론 질문을 다 정해주셔서 전혀 부담 안 됨. 점수에 크게 반영하지 않으신 듯.,김종석
에세이 과제도 점수 반영을 별로 안 하시는 것 같고.,김종석
시험은 간단한 주관식,김종석
"마지막은 서술형이었고, 주관식은 주로 많이 나오는 개념이나 사자성어임. 서술형도 쉬워서 생각나는 대로 열심히 쓰면 됨.",김종석
"어떤 교수님은 한자도 외우라 하는데, 김종석 교수님은 절대 구런 거 없음. 근데 서술형 답안에 한자를 섞어서 쓰면 점수를 잘 주시는 듯?",김종석
교수님은 무척 좋으십니다. 딱히 수강하는데 과제가 많다거나  부담이 많이 되는 수업은 아닙니다. 시험도 그렇게 어렵지 않구요. 근데 다만 수업 자체가 좀 재미가 있는건 아닙니다...,김종석
핵추천!,김종석
논어 교수님은 무조건 김종석교수님꺼 들어야함,김종석
"조과제 한번, 에세이 한번 중간 기말 끝",김종석
시험도 단답형이랑 논술형 한문제 나오는데 중요한건 요약집을 따로 올려주심,김종석
책 필요없고 요약만 외우면 시험 끝남 ㅋㅋ 핵추천,김종석
교수님 짱짱 좋으심,김종석
조별과제가 8인 1조로 했는데 좀 운영되기 힘듬,김종석
과제는 논어 에세이 쓰는거 연계로 하나 있음,김종석
시험은 단답형이랑 주관식 주시고 자기 생각 간단하게 쓰는거 나옴 막 외우는걸 무의미하게 생각하시기에 미친듯이 외우는 그런 문제는 없음,김종석
교수님 강의력은 보통? 그래도 난 재밌게 들음,김종석
교수님 정말 좋으심ㄹㅇ,김종석
이 정보를 확인하기 위해 포인트를 사용하시겠습,김종석
딱딱하지 않은 수업으로 논어를 쉽게 풀이해주셔서 좋았습니다. 시험은 오픈 노트북으로 수업 내 필기는 자유롭게 볼 수 있습니다.,한성구
"강의 재밌습니다. 위트있으시고 강의는 체계적이기보다는 이야기를 해주시는 것처럼 진행됩니다. 필기를 좀 잘하셔야해요 그렇지만 오픈노트이고, 많은 인문학적 지식 얻을 수 있어요 추천합니다",한성구
팀플 없고 레포트 하나가 있고  시험은  그동안 썼던 필기노트를 보고 쓰는 형식으로 이루어졌는데 앞으로는 어떻게 볼 지는.. ,한성구
교수님은 젠틀하시고 강의력도  괜찮으셔서 저는 꿀강인 것 같아요!,한성구
그냥저냥 괜찮습니다 강의는 약간 의식의 흐름이라고 느껴졌지만 어떻게 강의가 끝나면 내용은 연결되어있습니다. 신기해요. 과제를 열심히 합시다,한성구
과제는 가벼운 레포트 하나 밖에 없고 팀플발표도 없어요 교수님 강의력도 좋고  재밌습니다  필기는 놓치지말고 다 받아적으시는게 점수따기 좋아요,한성구
중간기말오픈북으로 진행되고 팀플 없습니다!,한성구
강의력도 좋으세요!,한성구
논어 중에  최고 꿀강  중간기말 오픈노트 시험이었고 발표도 없고 팀플도 없고 레포트 하나만 쓰면 끝!  수업도 딱딱하지 않게 재밌게 해주시고 난 사실 레포트도  반도 못쓴거 냈는데 쁠까지 달아주심 강추,한성구
음...별로였음 성적도짜고 그닥 그래도 낫배드,한성구
꿀강  ,한성구
 시험,한성구
오픈북,한성구
", 노팀플 끝 필기 열심히하시면 충분합니다. 다만 성적은 알려 주시지 않으니 유의하세요",한성구
진짜 성균논어로서  추천합니다,한성구
 ,한성구
"오픈북을 계속하실지는 모르겠지만 저흰 중간,기말 오픈북이었습니다!  과제도 유교가 없었더라면으로 하나밖에 없구, 조별 팀플 발표 다 없습니다",한성구
 ,한성구
수업 잘듣고 피피티 사진 찍고 출석만 다 하신다면 성적 잘 받으실 수 있습니다,한성구
과제 시험 이런 것이 꿀인걸 떠나서 그동안 한 학기 교양수업을 통해서 이 수업처럼 많은 지식을 얻은  적은 없었던 것 같네요. 정말 최고의 명강의입니다.,한성구
꿀 of 꿀!,한성구
필기,한성구
ppt 정리한 노트로 오픈북 시험! 중간 기말 모두 오픈북!,한성구
